{
  "schemaVersion": 1,
  "generatedAt": "2026-10-11T02:42:42.879Z",
  "seed": null,
  "actual": {
    "tag": "v26.10.0",
    "commit": "2bebdbaae0b701120a8cad9d56aafd64fa04c577",
    "packageVersion": "26.10.0"
  },
  "toolchain": {
    "node": "v24.21.0",
    "yarn": "4.17.1"
  },
  "generation": {
    "workingDirectory": "<pinned-oracle-root>",
    "argv": [
      "node",
      ".yarn/releases/yarn-4.17.1.cjs",
      "workspace",
      "@actual-app/core",
      "run",
      "test:node",
      "src/server/accounts/account-lifecycle-parity.test.ts",
      "--bail=1",
      "--reporter=json",
      "--outputFile=<pinned-oracle-root>/.actualist-account-lifecycle-vitest-<invocation-id>.json"
    ],
    "environment": {
      "ACTUALIST_ACCOUNT_LIFECYCLE_ORACLE_OUTPUT": "<pinned-oracle-root>/.actualist-account-lifecycle-oracle.json",
      "TZ": "UTC"
    },
    "executionCeilingMilliseconds": 180000,
    "terminationGraceMilliseconds": 5000,
    "processOwnership": "detached POSIX process group"
  },
  "generator": {
    "path": "scripts/account-lifecycle-parity/generate.mjs",
    "sha256": "a863ba21dbc49f01d720587842718e7e57ed938a676bb7f0653d99c7b5d51db7",
    "manifestSchemaPath": "scripts/account-lifecycle-parity/manifest.schema.json",
    "manifestSchemaSha256": "999b77ab5d05cdf7f04041e2cff8ecce7ce9f144fe7b4f4b26a748a2f384d7d2"
  },
  "harnessFiles": [
    {
      "path": "scripts/account-lifecycle-parity/harness/account-lifecycle-parity.test.ts",
      "sha256": "08469eac4de7f45f74ef63bb0588f05af8312effd08f5e449efa5c464d085a51"
    },
    {
      "path": "scripts/account-lifecycle-parity/harness/account-lifecycle-parity-support.ts",
      "sha256": "5faaf20784bbab518f2c15bb4a588bea895745f2ce5721b0df1bdd227d5f3d44"
    }
  ],
  "sourceFiles": [
    {
      "path": "packages/loot-core/package.json",
      "sha256": "f643dfe5b2a7749f6cd220ba65c0139447b9192ed78f8949f425b2776ddd526f"
    },
    {
      "path": "packages/loot-core/src/mocks/setup.ts",
      "sha256": "1deb435399c7871a57baea5668474ad2e8290d0925f472a1b971a1832ec18b70"
    },
    {
      "path": "packages/loot-core/src/server/accounts/app.ts",
      "sha256": "fe9e1d2150e63bd6f55443e38ecc4e2a0a2e708eec3aa631dd922784258ebc70"
    },
    {
      "path": "packages/loot-core/src/server/db/index.ts",
      "sha256": "0b3d3ee68b571523cc8cd3a7044ade50e8afea5941bb54879f45643f92241a71"
    },
    {
      "path": "packages/loot-core/src/server/db/mappings.ts",
      "sha256": "6ec833744859b6e14f9a83a91cbfa99980bfe1b69750c567a146e7b2ff0573b9"
    },
    {
      "path": "packages/loot-core/src/server/sql/init.sql",
      "sha256": "922a2b0b8ce621a2537293b887a4b75ceee6a375859f443407f8129bb6c29d3d"
    },
    {
      "path": "packages/loot-core/src/server/mutators.ts",
      "sha256": "f24756558fd2aadc3cbff1fd23514b5908ef6b319c1ad7d8eefeb5ee649f538f"
    },
    {
      "path": "packages/loot-core/src/server/schedules/app.ts",
      "sha256": "9cc505fba24effd2564871da3db9c781df831a138d04bdfbeaf67f338c2e9dc4"
    },
    {
      "path": "packages/loot-core/src/server/sync/index.ts",
      "sha256": "f597760aed699ff0f696b2ec433c1d59588e7f2dd53f4aa6518713dfd76c99b8"
    },
    {
      "path": "packages/loot-core/src/server/transactions/app.ts",
      "sha256": "6fbfa6064e60e2817fa9870a8e1762a69ee10d1b87893f40ab49dd683cac767c"
    },
    {
      "path": "packages/loot-core/src/server/transactions/index.ts",
      "sha256": "2c32a9e4a3f54da01dd54d9a141abaef9f3740daa6900640f804da17db9e6c02"
    },
    {
      "path": "packages/loot-core/src/server/transactions/transfer.ts",
      "sha256": "309ebae609b20dee6053bc0a84e80e310a0d53fd4aed7c284d7e4379c9305701"
    },
    {
      "path": "packages/loot-core/src/server/undo.ts",
      "sha256": "2b664e329d843c8022f935d131b7a88a40f85b3e64904faed50f8aeffd5deafe"
    },
    {
      "path": "packages/desktop-client/src/components/modals/CloseAccountModal.tsx",
      "sha256": "04d3581b112a62bef5c9aa9be36a0f29c841f3d9f8edc58ec29d5f254d85d4fb"
    },
    {
      "path": "packages/desktop-client/src/components/util/accountValidation.ts",
      "sha256": "745da1c3dd1ba474871bb27072552a0abf457e8eac083e4e72825ac40172813d"
    }
  ],
  "dependencies": {
    "lockfile": {
      "path": "yarn.lock",
      "sha256": "0326284066b6f9f9297c671eb792b034f4435cb26c8b5bfbc89fb7fa5aebb5f9"
    },
    "yarnConfiguration": {
      "path": ".yarnrc.yml",
      "sha256": "0d71cb2b9e27b6d36fd0319f0c16c96698ced674036ffc6ae5bed01511763ff9"
    },
    "installState": {
      "path": "node_modules/.yarn-state.yml",
      "sha256": "214cbf5b400d605fa767fb8ba2d7edd177e6484a341be30283795bcd1b55dc6b"
    },
    "nativeSQLite": {
      "packageName": "better-sqlite3",
      "version": "13.0.3",
      "platform": "darwin",
      "architecture": "arm64",
      "packageManifest": {
        "path": "node_modules/better-sqlite3/package.json",
        "sha256": "6c9ea355190dfce3646ad4d2a31c9506de36d884a6461b3655a2a0c4ba3d1695"
      },
      "resolvedEntry": {
        "path": "node_modules/better-sqlite3/lib/index.js",
        "sha256": "0d56e190de8623278641b613433e89c4af2e5c90092c9c6e425f873d7fbc7ccf"
      },
      "binary": {
        "path": "node_modules/better-sqlite3/prebuilds/darwin-arm64.node",
        "sha256": "98e0e8acd01c632fe5615243e1296af0372826f8783b18fc31c506f73c47459c"
      }
    }
  },
  "fixture": {
    "path": "ActualistTests/Fixtures/ActualCore26_10_0/AccountLifecycle/account-lifecycle-oracle.json",
    "sha256": "e1407a1db647e00c5eaed766da249ec66f655365e5539d62088e7868b887af5c",
    "caseCount": 22,
    "caseIDs": [
      "rename-open-history",
      "rename-closed",
      "rename-handler-input-boundary",
      "reopen-repeat-history",
      "close-empty-history",
      "close-zero",
      "close-positive-on-to-on-history",
      "close-negative-on-to-on",
      "close-on-to-off-hidden-category",
      "close-off-to-on",
      "close-off-to-off",
      "close-self-transfer-refusal",
      "close-split-balance",
      "forced-delete-simple",
      "forced-delete-split-transfer-graph",
      "unlink-simplefin",
      "unlink-gocardless-last-reference",
      "unlink-gocardless-shared-bank",
      "unlink-gocardless-without-token",
      "unlink-gocardless-remote-failure",
      "close-unlink-undo-boundary",
      "schedule-close-reopen-eligibility"
    ]
  },
  "cases": [
    {
      "id": "rename-open-history",
      "input": {
        "account": {
          "id": "source",
          "name": "Before",
          "closed": false
        },
        "name": "After"
      },
      "assertions": [
        "account-update emits only accounts.name",
        "History undo restores the previous name on the same account ID"
      ],
      "outputPointer": "account-lifecycle-oracle.json#/cases/0"
    },
    {
      "id": "rename-closed",
      "input": {
        "account": {
          "id": "source",
          "name": "Closed before",
          "closed": true
        },
        "name": "Closed after"
      },
      "assertions": [
        "closed accounts accept account-update",
        "the exact normalized CRDT delta is accounts.name only"
      ],
      "outputPointer": "account-lifecycle-oracle.json#/cases/1"
    },
    {
      "id": "rename-handler-input-boundary",
      "input": {
        "source": {
          "id": "source",
          "name": "Original"
        },
        "peer": {
          "id": "peer",
          "name": "Duplicate"
        },
        "submittedNames": [
          "Original",
          "  Original  ",
          "Duplicate",
          "duplicate"
        ]
      },
      "assertions": [
        "the core handler emits a name cell even when the value is unchanged",
        "the core handler does not trim outer whitespace",
        "the core handler does not reject exact or case-variant duplicate names",
        "desktop input validation is therefore a separate boundary, not handler behavior"
      ],
      "outputPointer": "account-lifecycle-oracle.json#/cases/2"
    },
    {
      "id": "reopen-repeat-history",
      "input": {
        "account": {
          "id": "source",
          "closed": true
        },
        "repeatedCalls": 2
      },
      "assertions": [
        "reopen writes accounts.closed = 0 on the same ID",
        "History undo restores closed = 1",
        "the pinned upstream handler emits another closed = 0 cell for a repeated reopen"
      ],
      "outputPointer": "account-lifecycle-oracle.json#/cases/3"
    },
    {
      "id": "close-empty-history",
      "input": {
        "account": {
          "id": "source",
          "livePhysicalTransactionCount": 0
        }
      },
      "assertions": [
        "empty close tombstones the account instead of setting closed",
        "empty close leaves the transfer payee live",
        "History undo resurrects the account"
      ],
      "outputPointer": "account-lifecycle-oracle.json#/cases/4"
    },
    {
      "id": "close-zero",
      "input": {
        "account": {
          "id": "source",
          "physicalRows": [
            {
              "id": "zero-row",
              "amount": 0
            }
          ]
        }
      },
      "assertions": [
        "a physical live row prevents empty deletion",
        "exact zero closes with accounts.closed = 1 and creates no transfer"
      ],
      "outputPointer": "account-lifecycle-oracle.json#/cases/5"
    },
    {
      "id": "close-positive-on-to-on-history",
      "input": {
        "source": {
          "id": "source",
          "offBudget": false,
          "balance": 4250
        },
        "destination": {
          "id": "destination",
          "offBudget": false
        }
      },
      "assertions": [
        "source closing amount is -balance and destination amount is balance",
        "same-budget-type transfer category is null",
        "History restores open state and tombstones both created transfer legs"
      ],
      "outputPointer": "account-lifecycle-oracle.json#/cases/6"
    },
    {